{
  "id": 1339,
  "code": "code-1",
  "findingsCount": 4,
  "findingsList": [143859, 146085, 1465330, 1465331],
  "teamId": 29,
  "serviceTier": "Bronze",
  "lifecycle": "production",
  "scanTypes": ["sslscan", "nmap", "nikto"],
  "findings": [
    {
      "id": 1,
      "name": "The Anti-Clickjacking X-Frame-Options Header Is Not Present.",
      "age": "7 months",
      "active": true,
      "severity": "Medium",
      "created": "2021-09-09 19:13",
      "foundBy": "Nikto Scan",
      "remediation": "N/ALook at https://developer.mozilla.org/en-US/docs/Web/HTTP/Headers/X-XSS-Protection , better to have a CSP.\r\nUse X-XSS-Protection: 1 as a header",
      "ageDays": 217,
      "link": "https://link/1",
      "hasRemediation": true
    },
    {
      "id": 2,
      "name": "The Anti-Clickjacking X-Frame-Options Header Is Not Present.",
      "age": "7 months",
      "active": true,
      "severity": "Medium",
      "created": "2021-09-09 18:20",
      "foundBy": "Nikto Scan",
      "remediation": "N/ALook at https://developer.mozilla.org/en-US/docs/Web/HTTP/Headers/X-XSS-Protection , better to have a CSP.\r\nUse X-XSS-Protection: 1 as a header",
      "ageDays": 217,
      "link": "https://link/2",
      "hasRemediation": true
    },
    {
      "id": 3,
      "name": "Retrieved via Header: 1.1 Varnish",
      "age": "1 months 28 days",
      "active": true,
      "severity": "Info",
      "created": "2022-02-17 15:16",
      "foundBy": "Nikto Scan",
      "remediation": null,
      "ageDays": 56,
      "link": "https://link/3",
      "hasRemediation": true
    },
    {
      "id": 4,
      "name": "Retrieved X-Served-by Header: Cache-Dub4332-Dub",
      "age": "1 months 28 days",
      "active": true,
      "severity": "Info",
      "created": "2022-02-17 15:16",
      "foundBy": "Nikto Scan",
      "remediation": null,
      "ageDays": 56,
      "link": "https://link/4",
      "hasRemediation": true
    }
  ],
  "snykProjects": [],
  "matchingSnykFindingsCount": 0,
  "totalFindings": 4,
  "findingsOverSla": {}
}
